{
    "name": "teste-mapeamento",
    "title": "Teste de mapeamento",
    "description": "Teste de mapeamento de propriedades de identificação de entidades.",
    "author": 1,
    "created": "2021-03-18T15:00:00",
    "modified": "2021-03-18T15:00:00",
    "version": "0.1.0",
    "standard": "Spectrum",
    "mapping": [
        {
            "map_id": 1,
            "entity_type": "Concept",
            "prop_name": "identified_by",
            "external_prop_name": "Object entry",
            "external_prop_type": "string",
            "map_value": {
                "type": "Identifier",
                "classified_as": [
                    {
                        "id": "http://vocab.getty.edu/aat/300312355",
                        "type": "Type",
                        "_label": "aat:accession numbers"
                    }
                ]
            },
            "status": "active"
        }
    ]
}
